{
  "name": "acme-wiki",
  "version": "0.3.1",
  "description": "Read and search the Acme wiki — every space, page, and attachment the signed-in user can see, with the wiki's own permissions applied.",
  "author": {
    "name": "Acme Team"
  },
  "mcpServers": "./.mcp.json",
  "skills": "./skills/",
  "interface": {
    "displayName": "Acme Wiki"
  }
}
